__label__PA	Gefitinib inhibition of drug resistance to doxorubicin by inactivating ABCG2 in thyroid cancer cell lines.
__label__PA	Inactivation of EGFR kinase by gefitinib was analyzed by Western blot analysis and immunofluorescence.
__label__PA	Gefitinib inhibition of drug resistance to doxorubicin by inactivating ABCG2 in thyroid cancer cell lines.
__label__PA	Extrusion assays using flow cytometry analysis were used to determine the ability of thyroid cancer cells to extrude the chemotherapy drug, doxorubicin, via the ABCG2 drug transporter in the presence or absence of gefitinib.
__label__PA	Inactivation of the EGFR kinase by gefitinib potentiates the cytotoxic effect of doxorubicin in thyroid cancer, most likely by decreasing the ability of the cell to extrude doxorubicin.
__label__PA	Inhibition of EGFR kinase activity by gefitinib causes the translocation of the ABCG2 drug transporter away from the plasma membrane, resulting in a concomitant decrease in doxorubicin extrusion in thyroid cancer cell lines.
__label__PA	A terminal deoxynucleotidyl transferase-mediated deoxyuridine triphosphate nick-end labeling assay was performed to demonstrate ABCG2-mediated apoptosis in the presence of doxorubicin.
__label__PA	Both ARO and WRO demonstrated differential ABCG2 expression, whereas both were sensitized to doxorubicin-induced apoptosis on ABCG2 knockdown with short interfering RNA.
__label__PA	Inactivation of the EGFR kinase by gefitinib potentiates the cytotoxic effect of doxorubicin in thyroid cancer, most likely by decreasing the ability of the cell to extrude doxorubicin.
__label__PA	Inhibition of EGFR kinase activity by gefitinib causes the translocation of the ABCG2 drug transporter away from the plasma membrane, resulting in a concomitant decrease in doxorubicin extrusion in thyroid cancer cell lines.
__label__PA	Inhibition of EGFR kinase activity by gefitinib causes the translocation of the ABCG2 drug transporter away from the plasma membrane, resulting in a concomitant decrease in doxorubicin extrusion in thyroid cancer cell lines.
__label__PA	Inhibition of EGFR kinase activity by gefitinib causes the translocation of the ABCG2 drug transporter away from the plasma membrane, resulting in a concomitant decrease in doxorubicin extrusion in thyroid cancer cell lines.
__label__PA	GSK221149A had similar affinity (K(i) = 4.1 nM) and selectivity for native oxytocin receptors from rat and produced a functional, competitive block of oxytocin-induced contractions in isolated rat myometrial strips with a pA(2) value of 8.18.
__label__PA	Oral administration of GSK221149A (5 mg/kg) was effective in inhibiting oxytocin-induced uterine contractions after single and multiple (4-day) dosing.
__label__PA	Intravenous administration of GSK221149A produced a dose-dependent decrease in oxytocin-induced uterine contractions in anesthetized rats with an ID(50) = 0.27 +/- 0.60 mg/kg (corresponding plasma concentrations were 88 ng/ml).
__label__PA	PML/RARalpha is directly targeted by all-trans-retinoic acid (ATRA), which degrades the oncoprotein and induces complete remission of malignancies.
__label__PA	ATRA co-operated with MEK inhibitor to increase degradation of PML/RARalpha and exhibited a convergence point in caspase activation with MEK inhibitors.
__label__PA	Assessment of 1177 human immunodeficiency virus (HIV) resistance genotypes at an HIV/AIDS clinic showed a decrease in the incidence of the K65R mutation, from 15.2% of isolates during the period 2002-2004 to 2.7% of isolates during the period 2005-2006 (P < .001), despite elevated and stable rates of tenofovir use.
__label__PA	One among the 17 genes studied is ATP7B which is involved in the transport of copper ions across the cell membrane into the cell.
__label__PA	Furthermore, in addition to antagonizing Top2 cleavage complex formation, dexrazoxane also induced rapid degradation of Top2beta, which paralleled the reduction of doxorubicin-induced DNA damage.
__label__PA	Doxorubicin-induced DNA damage was also specifically abolished by the proteasome inhibitors bortezomib and MG132 and much reduced in top2beta(-/-) mouse embryonic fibroblasts (MEF) compared with TOP2beta(+/+) MEFs, suggesting the involvement of proteasome and DNA topoisomerase IIbeta (Top2beta).
__label__PA	Together, our results suggest that dexrazoxane antagonizes doxorubicin-induced DNA damage through its interference with Top2beta, which could implicate Top2beta in doxorubicin cardiotoxicity.
__label__PA	Furthermore, in addition to antagonizing Top2 cleavage complex formation, dexrazoxane also induced rapid degradation of Top2beta, which paralleled the reduction of doxorubicin-induced DNA damage.
__label__PA	The specific involvement of proteasome and Top2beta in doxorubicin-induced DNA damage is consistent with a model in which proteasomal processing of doxorubicin-induced Top2beta-DNA covalent complexes exposes the Top2beta-concealed DNA double-strand breaks.
__label__PA	Doxorubicin-induced DNA damage was also specifically abolished by the proteasome inhibitors bortezomib and MG132 and much reduced in top2beta(-/-) mouse embryonic fibroblasts (MEF) compared with TOP2beta(+/+) MEFs, suggesting the involvement of proteasome and DNA topoisomerase IIbeta (Top2beta).
__label__PA	After feeding a diet containing FOS (100 g/kg diet) to rats for 2 d, we investigated gene transcripts of transient receptor potential vanilloid type 6 (TRPV6), calbindin-D9k, and plasma membrane calcium-ATPase 1b (PMCA1b).
__label__PA	The FOS diet increased expression of TRPV6 and calbindin-D9k but did not affect PMCA1b expression.
__label__PA	The FOS diet increased expression of TRPV6 and calbindin-D9k but did not affect PMCA1b expression.
__label__PA	After feeding a diet containing FOS (100 g/kg diet) to rats for 2 d, we investigated gene transcripts of transient receptor potential vanilloid type 6 (TRPV6), calbindin-D9k, and plasma membrane calcium-ATPase 1b (PMCA1b).
__label__PA	These results suggest that FOS increase calcium absorption by increasing mRNA expression of TRPV6 in rat colorectum, and cell culture analysis indicated that SCFA, as fermentation products of FOS, are involved in the increased mRNA expression of TRPV6.
__label__PA	Adalimumab is a subcutaneously administered, recombinant, human IgG1 monoclonal antibody specific for human tumor necrosis factor (TNF).
__label__PA	[3H]A-804598 ([3H]2-cyano-1-[(1S)-1-phenylethyl]-3-quinolin-5-ylguanidine) is a novel, potent, and selective antagonist radioligand for P2X7 receptors.
__label__PA	While several species selective P2X7 antagonists exist, A-804598 represents a structurally novel, competitive, and selective antagonist that has equivalent high affinity at rat (IC50 = 10 nM), mouse (IC50 = 9 nM) and human (IC50 = 11 nM) P2X7 receptors.
__label__PA	A-804598 also potently blocked agonist stimulated release of IL-1beta and Yo-Pro uptake from differentiated THP-1 cells that natively express human P2X7 receptors.
__label__PA	These data demonstrate that A-804598 is one of the most potent and selective antagonists for mammalian P2X7 receptors described to date and [3H]A-804598 is a high affinity antagonist radioligand that specifically labels rat P2X7 receptors.
__label__PA	MA and MD were reversible inhibitors of CYP3A with competitive Ki values of 2.7 and 0.2 microM, respectively.
__label__PA	Sequential metabolism is responsible for diltiazem-induced time-dependent loss of CYP3A.
__label__PA	We previously reported that microsomal inactivation kinetic parameters of diltiazem underpredicted CYP3A inactivation in hepatocytes.
__label__PA	Inactivation of CYP3A by diltiazem was dependent on microsomal protein concentration (25, 36, and 41% decrease in CYP3A activity at 0.2, 0.4, and 0.8 mg/ml microsomal protein, respectively, incubated with 10 microM diltiazem over 20 min), whereas inactivation by MA did not seem to be protein concentration-dependent.
__label__PA	Inactivation of CYP3A by diltiazem was dependent on microsomal protein concentration (25, 36, and 41% decrease in CYP3A activity at 0.2, 0.4, and 0.8 mg/ml microsomal protein, respectively, incubated with 10 microM diltiazem over 20 min), whereas inactivation by MA did not seem to be protein concentration-dependent.
__label__PA	In summary, time-dependent CYP3A inactivation by MA seems to be the major contributor responsible for the loss of CYP3A in human liver microsomes and human hepatocytes incubated with diltiazem.
__label__PA	In cryopreserved hepatocytes incubated with diltiazem, time-dependent loss of CYP3A was accompanied by increased formation of MA and MD, with the MA level similar to its K(I) at higher diltiazem concentrations.
__label__PA	In cryopreserved hepatocytes incubated with diltiazem, time-dependent loss of CYP3A was accompanied by increased formation of MA and MD, with the MA level similar to its K(I) at higher diltiazem concentrations.
__label__PA	In human liver microsomes, MA was a more potent time-dependent inactivator of CYP3A than its parent drug, with apparent k(inact) approximately 4-fold higher than that of diltiazem at a microsomal protein concentration of 0.2 mg/ml.
__label__PA	In human liver microsomes, MA was a more potent time-dependent inactivator of CYP3A than its parent drug, with apparent k(inact) approximately 4-fold higher than that of diltiazem at a microsomal protein concentration of 0.2 mg/ml.
__label__PA	MA and MD were reversible inhibitors of CYP3A with competitive Ki values of 2.7 and 0.2 microM, respectively.
__label__PA	In Bcr-Abl-positive mouse bone marrow cells, nonphosphorylatable Hsp90beta expression conferred imatinib (Gleevec) resistance.
__label__PA	We then found that this drug is the most potent TRPV1 antagonist known to increase T(b) of rats and mice and showed (by using knock-out mice) that the entire hyperthermic effect of AMG0347 is TRPV1 dependent.
__label__PA	The magnitude of the hyperthermic response depended on neither T(b) nor tail-skin temperature at the time of AMG0347 administration, thus indicating that AMG0347-induced hyperthermia results from blockade of tonic TRPV1 activation by nonthermal factors.
__label__PA	Paeonol suppresses intercellular adhesion molecule-1 expression in tumor necrosis factor-alpha-stimulated human umbilical vein endothelial cells by blocking p38, ERK and nuclear factor-kappaB signaling pathways.
__label__PA	Paeonol suppresses intercellular adhesion molecule-1 expression in tumor necrosis factor-alpha-stimulated human umbilical vein endothelial cells by blocking p38, ERK and nuclear factor-kappaB signaling pathways.
__label__PA	Paeonol suppresses intercellular adhesion molecule-1 expression in tumor necrosis factor-alpha-stimulated human umbilical vein endothelial cells by blocking p38, ERK and nuclear factor-kappaB signaling pathways.
__label__PA	The inhibitory effect of paeonol on ICAM-1 production might be mediated by inhibiting p38, ERK and NF-kappaB signaling pathways, which are involved in TNF-alpha-induced ICAM-1 production.
__label__PA	Paeonol suppresses intercellular adhesion molecule-1 expression in tumor necrosis factor-alpha-stimulated human umbilical vein endothelial cells by blocking p38, ERK and nuclear factor-kappaB signaling pathways.
__label__PA	Paeonol concentration-dependently inhibited the production of ICAM-1; it inhibited nuclear factor-kappaB (NF-kappaB) p65 translocation into the nucleus and the phosphorylation of inhibitory factor kappaBalpha (IkappaBalpha).
__label__PA	Paeonol concentration-dependently inhibited the production of ICAM-1; it inhibited nuclear factor-kappaB (NF-kappaB) p65 translocation into the nucleus and the phosphorylation of inhibitory factor kappaBalpha (IkappaBalpha).
__label__PA	Paeonol concentration-dependently inhibited the production of ICAM-1; it inhibited nuclear factor-kappaB (NF-kappaB) p65 translocation into the nucleus and the phosphorylation of inhibitory factor kappaBalpha (IkappaBalpha).
__label__PA	Paeonol inhibited U937 monocyte adhesion to HUVECs stimulated by TNF-alpha, suggesting that it may inhibit the binding of monocytes to endothelium by regulating the production of critical adhesion molecules by TNF-alpha.
__label__PA	Paeonol concentration-dependently inhibited the production of ICAM-1; it inhibited nuclear factor-kappaB (NF-kappaB) p65 translocation into the nucleus and the phosphorylation of inhibitory factor kappaBalpha (IkappaBalpha).
__label__PA	Paeonol concentration-dependently inhibited the production of ICAM-1; it inhibited nuclear factor-kappaB (NF-kappaB) p65 translocation into the nucleus and the phosphorylation of inhibitory factor kappaBalpha (IkappaBalpha).
__label__PA	Paeonol concentration-dependently inhibited the production of ICAM-1; it inhibited nuclear factor-kappaB (NF-kappaB) p65 translocation into the nucleus and the phosphorylation of inhibitory factor kappaBalpha (IkappaBalpha).
__label__PA	On the one hand, endocannabinoids have been implicated in the protective effects of IPC through cannabinoid CB1/CB2 receptor-dependent and -independent mechanisms.
__label__PA	Previous studies using synthetic CB1 receptor agonists or knockout mice demonstrated CB1 receptor-dependent protection against cerebral I/R injury in various animal models.
__label__PA	Excitedly, emerging studies using potent CB2 receptor agonists and/or knockout mice have provided compelling evidence that CB2 receptor activation is protective against myocardial, cerebral and hepatic I/R injuries by decreasing the endothelial cell activation/inflammatory response (for example, expression of adhesion molecules, secretion of chemokines, and so on), and by attenuating the leukocyte chemotaxis, rolling, adhesion to endothelium, activation and transendothelial migration, and interrelated oxidative/nitrosative damage.
__label__PA	We have developed a small-molecule inhibitor of all three vascular endothelial growth factor (VEGF) receptors (VEGFR), platelet-derived growth factor receptor, and c-Kit tyrosine kinases, pazopanib (GW786034), which selectively inhibits VEGF-induced endothelial cell proliferation.
__label__PA	We have developed a small-molecule inhibitor of all three vascular endothelial growth factor (VEGF) receptors (VEGFR), platelet-derived growth factor receptor, and c-Kit tyrosine kinases, pazopanib (GW786034), which selectively inhibits VEGF-induced endothelial cell proliferation.
__label__PA	We have developed a small-molecule inhibitor of all three vascular endothelial growth factor (VEGF) receptors (VEGFR), platelet-derived growth factor receptor, and c-Kit tyrosine kinases, pazopanib (GW786034), which selectively inhibits VEGF-induced endothelial cell proliferation.
__label__PA	We have developed a small-molecule inhibitor of all three vascular endothelial growth factor (VEGF) receptors (VEGFR), platelet-derived growth factor receptor, and c-Kit tyrosine kinases, pazopanib (GW786034), which selectively inhibits VEGF-induced endothelial cell proliferation.
__label__PA	We have developed a small-molecule inhibitor of all three vascular endothelial growth factor (VEGF) receptors (VEGFR), platelet-derived growth factor receptor, and c-Kit tyrosine kinases, pazopanib (GW786034), which selectively inhibits VEGF-induced endothelial cell proliferation.
__label__PA	We have developed a small-molecule inhibitor of all three vascular endothelial growth factor (VEGF) receptors (VEGFR), platelet-derived growth factor receptor, and c-Kit tyrosine kinases, pazopanib (GW786034), which selectively inhibits VEGF-induced endothelial cell proliferation.
__label__PA	Novel iminobenzoxathiolone compound inhibits nuclear factor-kappaB activation targeting inhibitory kappaB kinase beta and down-regulating interleukin-1beta expression in lipopolysaccharide-activated macrophages.
__label__PA	Furthermore, LYR-71 down-regulated LPS-induced transcription of interleukin (IL)-1beta or other cytokines in the cells, and inhibited expression vector IKKbeta-elicited IL-1beta promoter activity.
__label__PA	Furthermore, LYR-71 down-regulated LPS-induced transcription of interleukin (IL)-1beta or other cytokines in the cells, and inhibited expression vector IKKbeta-elicited IL-1beta promoter activity.
__label__PA	LYR-71 inhibited IKKbeta-mediated phosphorylation of cytoplasmic IkappaBalpha in lipopolysaccharide (LPS)-activated macrophages, and sequentially preventing IkappaBalpha degradation as well as transcriptional activation of NF-kappaB.
__label__PA	Taken together, LYR-71 was an efficient inhibitor of IKKbeta, preventing NF-kappaB activation in macrophages, and this mechanism of action could contribute its down-regulatory effect on LPS-induced expression of inflammatory cytokines at the transcription level.
__label__PA	Taken together, LYR-71 was an efficient inhibitor of IKKbeta, preventing NF-kappaB activation in macrophages, and this mechanism of action could contribute its down-regulatory effect on LPS-induced expression of inflammatory cytokines at the transcription level.
__label__PA	LYR-71 inhibited IKKbeta-mediated phosphorylation of cytoplasmic IkappaBalpha in lipopolysaccharide (LPS)-activated macrophages, and sequentially preventing IkappaBalpha degradation as well as transcriptional activation of NF-kappaB.
__label__PA	LYR-71 inhibited IKKbeta-mediated phosphorylation of cytoplasmic IkappaBalpha in lipopolysaccharide (LPS)-activated macrophages, and sequentially preventing IkappaBalpha degradation as well as transcriptional activation of NF-kappaB.
__label__PA	To counter this, we have studied the pharmacokinetics in mice of two murine analogs of human TNF blockers, a murine p75-FC fusion protein (analogous to etanercept), and the rat MP6-XT22 anti-murine TNF mAb (analogous to infliximab).
__label__PA	Phosphorylation of EGFR and activated downstream signaling proteins, such as ERK1, JNK and P38, were found to be depressed after incubation with F90 for 48 hours in vitro.
__label__PA	Phosphorylation of EGFR and activated downstream signaling proteins, such as ERK1, JNK and P38, were found to be depressed after incubation with F90 for 48 hours in vitro.
__label__PA	Phosphorylation of EGFR and activated downstream signaling proteins, such as ERK1, JNK and P38, were found to be depressed after incubation with F90 for 48 hours in vitro.
__label__PA	Phosphorylation of EGFR and activated downstream signaling proteins, such as ERK1, JNK and P38, were found to be depressed after incubation with F90 for 48 hours in vitro.
__label__PA	Two monoclonal antibodies, cetuximab, which targets EGFR, and bevacizumab, which target the VEGF signaling pathway, are being evaluated as monotherapy and in combination with other agents and/or radiotherapy for the treatment of cervical cancer.
__label__PA	Two monoclonal antibodies, cetuximab, which targets EGFR, and bevacizumab, which target the VEGF signaling pathway, are being evaluated as monotherapy and in combination with other agents and/or radiotherapy for the treatment of cervical cancer.
__label__PA	Using these methods, we show that EGFR kinase inhibitors sensitize colorectal SW-480 tumor cells for 5-fluorouracil-induced apoptosis, indicating that EGFR-mediated survival signaling contributes to apoptosis resistance via its intrinsic kinase activity.
__label__PA	In cells grown under hypoxia for 6 h, BRCA1 was not decreased, but induction of CYP1A1 by TCDD was significantly decreased.
__label__PA	Treatment with 2,3,7,8-tetrachlorodibenzo-p-dioxin (TCDD) induces CYP1A1 protein and mRNA levels and also activates inhibitory AhR-ERalpha crosstalk associated with hormone-induced reporter gene expression.
__label__PA	Cotreatment of ZR-75 cells with TCDD plus the protein synthesis inhibitor cycloheximide for 6 h enhanced CYP1A1 expression in cells grown under hypoxia and normoxia.
__label__PA	Cotreatment of ZR-75 cells with TCDD plus the protein synthesis inhibitor cycloheximide for 6 h enhanced CYP1A1 expression in cells grown under hypoxia and normoxia.
__label__PA	Treatment with 2,3,7,8-tetrachlorodibenzo-p-dioxin (TCDD) induces CYP1A1 protein and mRNA levels and also activates inhibitory AhR-ERalpha crosstalk associated with hormone-induced reporter gene expression.
__label__PA	In ZR-75 cells grown under hypoxia, induction of these AhR-mediated responses by TCDD was significantly inhibited.
__label__PA	Here we show the reversal effects of an extensive panel of flavonoids upon BCRP-, P-gp-, and MRP1-mediated drug resistance.
__label__PA	Here we show the reversal effects of an extensive panel of flavonoids upon BCRP-, P-gp-, and MRP1-mediated drug resistance.
__label__PA	We previously reported that some flavonoids have BCRP-inhibitory activity.
__label__PA	Flavonoids inhibit breast cancer resistance protein-mediated drug resistance: transporter specificity and structure-activity relationship.
__label__PA	Here we show the reversal effects of an extensive panel of flavonoids upon BCRP-, P-gp-, and MRP1-mediated drug resistance.
__label__PA	Among these active compounds, 3',4',7-trimethoxyflavone showed the strongest anti-BCRP activity with RI(50) values of 0.012 microM for SN-38 and 0.044 muM for mitoxantrone.
__label__PA	The reversal of BCRP activity was tested by measuring the fluorescence of intracellular topotecan.
__label__PA	Our present results thus indicate that many flavonoids selectively inhibit BCRP only.
__label__PA	We report here the chemical synthesis and pharmacological characterization of SHA 66 (3-oxo-1,1-diphenyl-tetrahydro-oxazolo[3,4-a]pyrazine-7-carboxylic acid benzylamide) and SHA 68 (3-oxo-1,1-diphenyl-tetrahydro-oxazolo[3,4-a]pyrazine-7-carboxylic acid 4-fluoro-benzylamide), two closely related bicyclic piperazines with antagonistic properties at the NPS receptor (NPSR).
__label__PA	We report here the chemical synthesis and pharmacological characterization of SHA 66 (3-oxo-1,1-diphenyl-tetrahydro-oxazolo[3,4-a]pyrazine-7-carboxylic acid benzylamide) and SHA 68 (3-oxo-1,1-diphenyl-tetrahydro-oxazolo[3,4-a]pyrazine-7-carboxylic acid 4-fluoro-benzylamide), two closely related bicyclic piperazines with antagonistic properties at the NPS receptor (NPSR).
__label__PA	Furthermore, peripheral administration of SHA 68 in mice (50 mg/kg i.p.) is able to antagonize NPS-induced horizontal and vertical activity as well as stereotypic behavior.
__label__PA	Synthesis and pharmacological in vitro and in vivo profile of 3-oxo-1,1-diphenyl-tetrahydro-oxazolo[3,4-a]pyrazine-7-carboxylic acid 4-fluoro-benzylamide (SHA 68), a selective antagonist of the neuropeptide S receptor.
__label__PA	We report here the chemical synthesis and pharmacological characterization of SHA 66 (3-oxo-1,1-diphenyl-tetrahydro-oxazolo[3,4-a]pyrazine-7-carboxylic acid benzylamide) and SHA 68 (3-oxo-1,1-diphenyl-tetrahydro-oxazolo[3,4-a]pyrazine-7-carboxylic acid 4-fluoro-benzylamide), two closely related bicyclic piperazines with antagonistic properties at the NPS receptor (NPSR).
__label__PA	We report here the chemical synthesis and pharmacological characterization of SHA 66 (3-oxo-1,1-diphenyl-tetrahydro-oxazolo[3,4-a]pyrazine-7-carboxylic acid benzylamide) and SHA 68 (3-oxo-1,1-diphenyl-tetrahydro-oxazolo[3,4-a]pyrazine-7-carboxylic acid 4-fluoro-benzylamide), two closely related bicyclic piperazines with antagonistic properties at the NPS receptor (NPSR).
__label__PA	The compounds block NPS-induced Ca2+ mobilization, and SHA 68 shows displaceable binding to NPSR in the nanomolar range.
__label__PA	Therefore, SHA 68 could be a useful tool to characterize physiological functions and pharmacological parameters of the NPS system in vitro and in vivo.
__label__PA	In vitro studies using Western blot analysis and cell-based ELISA assays showed that P2281 inhibits mTOR activity in colon cancer cells.
__label__PA	In the dextran sulfate sodium (DSS) model of colitis, 1) macroscopic colon observations demonstrated that P2281 significantly inhibited DSS-induced weight loss, improved rectal bleeding index, decreased disease activity index, and reversed DSS-induced shortening of the colon; 2) histological analyses of colonic tissues revealed that P2281 distinctly attenuated DSS-induced edema, prominently diminished the leukocyte infiltration in the colonic mucosa, and resulted in protection against DSS-induced crypt damage; and 3) Western blot analysis showed that P2281 blocks DSS-induced activation of mTOR.
__label__PA	In vitro and in vivo assays of proinflammatory cytokine production revealed that P2281 diminishes induced IFN-gamma production but not TNF-alpha production, indicating preferential inhibitory effects of P2281 on T cell function.
__label__PA	In the dextran sulfate sodium (DSS) model of colitis, 1) macroscopic colon observations demonstrated that P2281 significantly inhibited DSS-induced weight loss, improved rectal bleeding index, decreased disease activity index, and reversed DSS-induced shortening of the colon; 2) histological analyses of colonic tissues revealed that P2281 distinctly attenuated DSS-induced edema, prominently diminished the leukocyte infiltration in the colonic mucosa, and resulted in protection against DSS-induced crypt damage; and 3) Western blot analysis showed that P2281 blocks DSS-induced activation of mTOR.
__label__PA	In the dextran sulfate sodium (DSS) model of colitis, 1) macroscopic colon observations demonstrated that P2281 significantly inhibited DSS-induced weight loss, improved rectal bleeding index, decreased disease activity index, and reversed DSS-induced shortening of the colon; 2) histological analyses of colonic tissues revealed that P2281 distinctly attenuated DSS-induced edema, prominently diminished the leukocyte infiltration in the colonic mucosa, and resulted in protection against DSS-induced crypt damage; and 3) Western blot analysis showed that P2281 blocks DSS-induced activation of mTOR.
