__label__NA	The results do not suggest a contribution of A2M and LRP to the development of MS.
__label__PA	our data suggests that the A2M D allele is a modest risk factor for late-onset sporadic AD in Koreans, and the AD risk conferred by the A2M D allele increases in APOE epsilon4 negative subjects.
__label__PA	our data suggests that the A2M D allele is a modest risk factor for late-onset sporadic AD in Koreans, and the AD risk conferred by the A2M D allele increases in APOE epsilon4 negative subjects.
__label__PA	our data suggests that the A2M D allele is a modest risk factor for late-onset sporadic AD in Koreans, and the AD risk conferred by the A2M D allele increases in APOE epsilon4 negative subjects.
__label__PA	our data suggests that the A2M D allele is a modest risk factor for late-onset sporadic AD in Koreans, and the AD risk conferred by the A2M D allele increases in APOE epsilon4 negative subjects.
__label__NA	In conclusion, we observed no association between either the intronic deletion polymorphism or the Ile1000Val polymorphism of A2M and AD in our case-control cohort.
__label__NA	The results of this study revealed no association between the I1000V polymorphism of A2M and Chinese sporadic AD in Guangzhou and Chengdu.
__label__NA	The lack of statistically significant difference between G/G frequencies in both groups of patients may suggest that alpha 2-macroglobulin G/G genotype is not a risk factor for AD.
__label__NA	Our data do not support a role for the A2M gene as genetic risk factor for AD.
__label__NA	Using logistic regression and multiple correlation analysis (MCA), we confirmed that the main risk factor associated and consistently grouped with AD patients in this population is APOE4, but this association was not observed with alleles and genotypes of ACE and A2M.
__label__NA	We conclude that  there is no genetic association between A2M and AD in our case-control sample.
__label__NA	The A2M polymorphism does not affect the development of sporadic AD or formation of AD-type neuropathologic changes.
__label__NA	The A2M polymorphism does not affect the development of sporadic AD or formation of AD-type neuropathologic changes.
__label__NA	The results do not suggest a contribution of A2M and LRP to the development of MS.
__label__PA	The wild-type allele of the TNF-alpha promoter polymorphism may be associated with mechanisms of asthmatic sensitivity to inhaled SO2.
__label__NA	Polymorphisms in the TNF-alpha promoter region and TNF-receptor genes are not associated with the development of CAD.
__label__NA	Polymorphisms in the TNF-alpha promoter region and TNF-receptor genes are not associated with the development of CAD.
__label__NA	We conclude that  the effect of the -308G > A polymorphism on the development of schizophrenia is, if any, weak and the majority of Japanese schizophrenics are unrelated to the -308G > A polymorphism of the TNF-alpha gene.
__label__NA	No associations were found between the -308 TNF promoter polymorphism, serum and ex vivo TNF levels and the cytotoxic activity of TNF in RA patients.
__label__NA	No associations were found between the -308 TNF promoter polymorphism, serum and ex vivo TNF levels and the cytotoxic activity of TNF in RA patients.
__label__NA	No associations were found between the -308 TNF promoter polymorphism, serum and ex vivo TNF levels and the cytotoxic activity of TNF in RA patients.
__label__NA	In African Americans and whites, neither the TNF2 allele nor another polymorphism in the TNF-alpha gene or a neighboring gene with which the TNF2 allele is in linkage disequilibrium is associated with differences in the level of or increased clustering of components of the insulin resistance syndrome.
__label__NA	Functional variants of CD14 -260C/T, TNF-alpha -308G/A, and IL-6 -174G/C, implicated in the susceptibility to infection, are unlikely to confer major risk for susceptibility to coronary atherosclerosis and its progression or response to therapy in the LCAS population.
__label__NA	Neither the genotypic frequencies for tumor necrosis factor alpha mutant alleles nor maternal tumor necrosis factor alpha plasma levels were increased in patients with severe preeclampsia.
__label__NA	Neither the genotypic frequencies for tumor necrosis factor alpha mutant alleles nor maternal tumor necrosis factor alpha plasma levels were increased in patients with severe preeclampsia.
__label__NA	We conclude that  IL-4-589*T, but not TNF-alpha-308*2 or Fcalpha RIbeta*G, is a risk factor for the development of atopy, asthma, and rhinitis by 12 mo of age.
__label__PA	We conclude that  TLR4 mutations represent a risk factor for meningococcal disease in this age group.
__label__PA	The association found between TLR4 genotype and risk of MI suggests that TLR4 genetic variants could potentially affect the susceptibility to MI and that TLR4-mediated innate immunity is implicated in the pathogenesis of MI.
__label__PA	The association found between TLR4 genotype and risk of MI suggests that TLR4 genetic variants could potentially affect the susceptibility to MI and that TLR4-mediated innate immunity is implicated in the pathogenesis of MI.
__label__PA	The association found between TLR4 genotype and risk of MI suggests that TLR4 genetic variants could potentially affect the susceptibility to MI and that TLR4-mediated innate immunity is implicated in the pathogenesis of MI.
__label__PA	The association found between TLR4 genotype and risk of MI suggests that TLR4 genetic variants could potentially affect the susceptibility to MI and that TLR4-mediated innate immunity is implicated in the pathogenesis of MI.
__label__PA	The association found between TLR4 genotype and risk of MI suggests that TLR4 genetic variants could potentially affect the susceptibility to MI and that TLR4-mediated innate immunity is implicated in the pathogenesis of MI.
__label__PA	The association found between TLR4 genotype and risk of MI suggests that TLR4 genetic variants could potentially affect the susceptibility to MI and that TLR4-mediated innate immunity is implicated in the pathogenesis of MI.
__label__PA	The association found between TLR4 genotype and risk of MI suggests that TLR4 genetic variants could potentially affect the susceptibility to MI and that TLR4-mediated innate immunity is implicated in the pathogenesis of MI.
__label__PA	The association found between TLR4 genotype and risk of MI suggests that TLR4 genetic variants could potentially affect the susceptibility to MI and that TLR4-mediated innate immunity is implicated in the pathogenesis of MI.
__label__PA	The association found between TLR4 genotype and risk of MI suggests that TLR4 genetic variants could potentially affect the susceptibility to MI and that TLR4-mediated innate immunity is implicated in the pathogenesis of MI.
__label__NA	Our data indicate that these TLR4 polymorphisms have no influence on the incidence, progression and inflammatory parameters of MS.
__label__NA	The findings of this study do not support the hypothesis that the TLR4 Asp299Gly polymorphism influences predisposition to and progression of coronary artery disease.
__label__NA	Therefore, this functional TLR4 polymorphism does not influence susceptibility to or severity of meningococcal disease.
__label__NA	The presence of the Asp299Gly allele of the TLR4 gene does not seem to exert a major influence on the progression of atherosclerosis in patients with FH.
__label__NA	In conclusion, a case-control study was used to analyze, for the first time, the influence of TLR2 and TLR4 gene polymorphism on the predisposition and clinical characteristics of SLE and RA but provided no evidence for association of TLR2 or TLR4 gene polymorphism with either disease in the population under study.
__label__NA	In conclusion, a case-control study was used to analyze, for the first time, the influence of TLR2 and TLR4 gene polymorphism on the predisposition and clinical characteristics of SLE and RA but provided no evidence for association of TLR2 or TLR4 gene polymorphism with either disease in the population under study.
__label__PA	Mutations in the TLR4 receptor may predispose people to develop septic shock with gram-negative microorganisms.
__label__NA	Therefore, this functional TLR4 polymorphism does not influence susceptibility to or severity of meningococcal disease.
__label__PA	In conclusion, the present data suggest that the arginine to glutamine substitution at residue 753 polymorphism of the Toll-like receptor 2 gene influences the risk of developing tuberculosis.
__label__PA	Our results suggest that genetic variation in TLR2 is a major determinant of the susceptibility to asthma and allergies in children of farmers.
__label__NA	In conclusion, a case-control study was used to analyze, for the first time, the influence of TLR2 and TLR4 gene polymorphism on the predisposition and clinical characteristics of SLE and RA but provided no evidence for association of TLR2 or TLR4 gene polymorphism with either disease in the population under study.
__label__NA	In conclusion, a case-control study was used to analyze, for the first time, the influence of TLR2 and TLR4 gene polymorphism on the predisposition and clinical characteristics of SLE and RA but provided no evidence for association of TLR2 or TLR4 gene polymorphism with either disease in the population under study.
__label__PA	Consistent association in two independent samples and association with an intermediate phenotype provides strong support for TLR10 genetic variation contributing to asthma risk.
__label__PA	These findings suggest that the presence of the variant allele in the promoter of MMP2 or TIMP2 may be a protective factor for the development of breast cancer.
__label__PA	These findings suggest that the presence of the variant allele in the promoter of MMP2 or TIMP2 may be a protective factor for the development of breast cancer.
__label__NA	Our data show that neither genetic variability nor protein levels of TIMP-1 are associated with AD.
__label__PA	Our results strongly suggest that the variations of Tim-1 exon 4 might be associated with the susceptibility to RA.
__label__PA	Our results strongly suggest that polymorphism in the Tim-1 promoter region might be associated with susceptibility to RA.
__label__PA	The observation of frequency differences between cases and controls in two independent samples strongly suggests that the TPO gene is involved as a risk factor for developing MI at a young age, but the identified polymorphisms are probably acting as markers for an unidentified functional mutation elsewhere in the gene locus.
__label__PA	The observation of frequency differences between cases and controls in two independent samples strongly suggests that the TPO gene is involved as a risk factor for developing MI at a young age, but the identified polymorphisms are probably acting as markers for an unidentified functional mutation elsewhere in the gene locus.
__label__PA	These results indicated that G-33A polymorphism in TM might be a genetic risk factor for myocardial infarction.
__label__PA	Our results suggest a role for tyrosine hydroxylase in early-onset alcoholism.
__label__NA	These results indicate that exon 3 of the human TH gene lacks association with schizophrenia in Japanese patients.
__label__NA	These results indicate that exon 3 of the human TH gene lacks association with schizophrenia in Japanese patients.
__label__PA	These results suggest that the CC genotype of the TFPI intron 7 polymorphism is an independent protective factor for venous thromboembolism, an effect probably mediated by increased TFPI levels.
__label__PA	These results suggest that the CC genotype of the TFPI intron 7 polymorphism is an independent protective factor for venous thromboembolism, an effect probably mediated by increased TFPI levels.
__label__PA	The findings suggest that a TFAM haplotype containing rs1937 G (for S12) may be a moderate risk factor for AD.
__label__NA	The TF C2 variant did not confer a risk for AD in Koreans.
__label__PA	These results suggest that apoE and transferrin may be part of a complex mechanism in the pathogenesis of Alzheimer's disease.
__label__NA	In conclusion, neither the BCHE K nor the TF C2 confers a risk for AD.
__label__PA	These data suggest that T-bet variation contributes to airway responsiveness in asthma.
__label__NA	These findings suggest that the TAP1 gene is not primarily involved in susceptibility to allergic rhinitis in the Japanese population.
__label__PA	While independent reproduction of these data in other data sets is indicated, our work is suggestive for a role of the TAC1 gene in MS.
__label__PA	The findings support a role for synapsin III in a subset of African American patients with schizophrenia and raises questions about selective pressure in Africa to account for the extraordinary disparity of the 469 and 470 single-nucleotide polymorphisms in different ethnic populations.
__label__PA	This study suggests a positive association between synapsin II and schizophrenia, implying that synapsin II is involved in the etiology of schizophrenia.
__label__PA	This study suggests a positive association between synapsin II and schizophrenia, implying that synapsin II is involved in the etiology of schizophrenia.
__label__PA	This study suggests a positive association between synapsin II and schizophrenia, implying that synapsin II is involved in the etiology of schizophrenia.
__label__PA	This study suggests a positive association between synapsin II and schizophrenia, implying that synapsin II is involved in the etiology of schizophrenia.
__label__PA	These findings suggest that genetic polymorphisms of SULT1E1 are associated with increased risk and a disease free survival of breast cancer in Korean women.
__label__PA	Our study showed that gene polymorphisms of CYP1B1 and SULT1A1 induce an individual susceptibility to breast cancer among current smokers.
__label__PA	These results suggest that the high activity SULT1A1*1 allozyme protects against dietary and/or environmental chemicals involved in the pathogenesis of colorectal cancer.
__label__PA	These results indicate that variations in SULT1A1 activity contributes to prostate cancer risk and the magnitude of the association may differ by ethnicity and be modified by meat consumption.
__label__PA	SULT1A1 His allele is positively associated with the risk of breast cancer, and an interaction exist between this allele and related exposure factors.
__label__PA	Our results, which are against the original hypothesis, demonstrate that the variant SULT1A1 638A allele is associated with susceptibility to lung cancer in relation to tobacco smoking.
__label__PA	We conclude that  the SULT1A1 R213H polymorphism is not linked with colorectal cancer in this elderly Australian population.
__label__PA	Our findings suggest that the SULT1A1 his(213) allele is important in the development of esophageal cancer in men.
__label__PA	Our findings are consistent with a prior report that the Arg/His polymorphism in SULT1A1 is associated with breast cancer risk.
__label__PA	The results from this study suggest that homozygosity for the SULT1A1 His213 allele may be a risk factor for breast cancer, and its effect may be modified by the exposure level of endogenous estrogens and heterocyclic amines.
__label__PA	Our results support the hypothesis that a genetic polymorphism in the SULT1A1 gene may be associated with increased lung cancer risk.
__label__PA	Our study showed that gene polymorphisms of CYP1B1 and SULT1A1 induce an individual susceptibility to breast cancer among current smokers.
__label__PA	These results quantitatively show the spectrum of cancer risk associated with STK11 germline mutations in the context of PJS and provide a valuable reference for defining surveillance regimens.
__label__PA	We conclude that  the human STAT6 gene is rather involved in the development of eosinophilia and changes in total IgE levels than contributing to the pathogenesis of asthma.
__label__PA	We conclude that  the human STAT6 gene is rather involved in the development of eosinophilia and changes in total IgE levels than contributing to the pathogenesis of asthma.
__label__NA	We conclude that  the human STAT6 gene is rather involved in the development of eosinophilia and changes in total IgE levels than contributing to the pathogenesis of asthma.
__label__PA	Our results indicate that genetic variants in STAT3, independent of asthma treatment, are determinants of FEV1 in both adults and children with asthma, and suggest that STAT3 may participate in inflammatory pathways that have an impact on level of lung function.
__label__PA	Our results indicate that genetic variants in STAT3, independent of asthma treatment, are determinants of FEV1 in both adults and children with asthma, and suggest that STAT3 may participate in inflammatory pathways that have an impact on level of lung function.
__label__PA	Our results indicate that genetic variants in STAT3, independent of asthma treatment, are determinants of FEV1 in both adults and children with asthma, and suggest that STAT3 may participate in inflammatory pathways that have an impact on level of lung function.
__label__PA	Our results indicate that genetic variants in STAT3, independent of asthma treatment, are determinants of FEV1 in both adults and children with asthma, and suggest that STAT3 may participate in inflammatory pathways that have an impact on level of lung function.
__label__PA	The study indicated that 1784GC/CC genotypes of SREBP-2 were significantly related with the elevated concentrations of serum TC and LDL-C in hypercholesterolemic subjects, and further work is necessary to confirm the role of 1784G > C polymorphism of SREBP-2 gene in the development of hyperlipidemia.
__label__PA	The study indicated that 1784GC/CC genotypes of SREBP-2 were significantly related with the elevated concentrations of serum TC and LDL-C in hypercholesterolemic subjects, and further work is necessary to confirm the role of 1784G > C polymorphism of SREBP-2 gene in the development of hyperlipidemia.
__label__NA	Our results do not support the hypothesis that the V89L and A49T polymorphisms in the SRD5A2 gene are related to the risk of prostate cancer, but are compatible with the suggestion from earlier studies that men who are homozygous for the TA(9) or (18) alleles and men who have the TA(9)/TA(18) genotype are at a modestly reduced risk.
__label__PA	The results suggest that, in Japanese patients, micropenis can be caused by SRD5A2 gene mutations, especially by R227Q which has been shown to retain approximately 3.2% of normal enzyme activity and appears relatively frequent in Asian populations, and that V89L polymorphism is unlikely to raise the susceptibility to the development of micropenis.
__label__PA	The results suggest that, in Japanese patients, micropenis can be caused by SRD5A2 gene mutations, especially by R227Q which has been shown to retain approximately 3.2% of normal enzyme activity and appears relatively frequent in Asian populations, and that V89L polymorphism is unlikely to raise the susceptibility to the development of micropenis.
__label__PA	The V allele of the V89L polymorphism in the SRD5A2 gene may dominantly increase the risk of prostate cancer.
__label__PA	Men who have the V allele of the SRD5A2 gene have a twofold increase in the risk of prostate cancer development and an additional twofold increase in the risk of progression compared with men with the L/L genotype.
__label__NA	Our results do not support the hypothesis that the V89L and A49T polymorphisms in the SRD5A2 gene are related to the risk of prostate cancer, but are compatible with the suggestion from earlier studies that men who are homozygous for the TA(9) or (18) alleles and men who have the TA(9)/TA(18) genotype are at a modestly reduced risk.
__label__PA	The V allele of the V89L polymorphism in the SRD5A2 gene may dominantly increase the risk of prostate cancer.
__label__NA	Despite strong theoretical reasons to consider osteopontin as a potential candidate, the results of our study argue against the gene being a susceptibility locus for either the development or clinical severity of MS.
__label__NA	The SPINK1 N34S mutation appears not to predispose Hispanic or non-Hispanic white people from the USA to the development of Type 2 diabetes mellitus.
__label__NA	The N34S mutation of SPINK1 appears not to be a distinct genetic risk factor in patients with sporadic pancreatic cancer.
__label__PA	Identification of SPINK1 mutations in 12.2% of patients with adult alcoholic and idiopathic chronic pancreatitis suggests an important role for SPINK1 as a predisposing factor in adult chronic pancreatitis.
__label__PA	Identification of SPINK1 mutations in 12.2% of patients with adult alcoholic and idiopathic chronic pancreatitis suggests an important role for SPINK1 as a predisposing factor in adult chronic pancreatitis.
__label__NA	Polymorphisms in the oxidative stress-related genes (CYP1A1, GSTM1, GSTT1, MPO, MnSOD) do not seem to be risk factors for preeclampsia.
__label__PA	These findings suggest that individual susceptibility of bladder cancer may be modulated by MPO and MnSOD polymorphisms, and that the combination of genetic factors involved in oxidative stress response with environmental carcinogens may play an important role in bladder carcinogenesis.
__label__NA	We observed no statistically significant interaction between MnSOD genotype and asbestos exposure for lung cancer risk.
__label__NA	Sequence variation in SOD2 is not the major cause of radiotherapy complications in women with breast cancer.
__label__PA	In patients with hereditary haemochromatosis, the MnSOD genotype affects the risk of cardiomyopathy related to iron overload and possibly to other known and unknown risk factors and could represent an iron toxicity modifier gene.
__label__PA	Therefore, MnSOD 1183C polymorphisms may be a precipitating factor for the development of psoriatic arthritis.
__label__NA	Results do not support any overall association of the Ala-9Val MnSOD polymorphism to the development of breast cancer.
__label__PA	These data suggest that the Ala allele of MnSOD may modify breast cancer risk among current smokers, but is not an independent risk factor for breast cancer.
__label__PA	These data suggest that the Ala allele of MnSOD may modify breast cancer risk among current smokers, but is not an independent risk factor for breast cancer.
__label__PA	This finding supports the proposal that MnSOD genotypes may modify individual breast cancer risk.
__label__NA	Results do not support any overall association of the Ala-9Val MnSOD polymorphism to the development of breast cancer.
__label__PA	This finding supports the proposal that MnSOD genotypes may modify individual breast cancer risk.
__label__NA	In this study of 233 ALS cases and 248 controls the authors found no significant association between four individual single nucleotide polymorphisms and a deletion spanning the SOD1 locus (or their combined haplotypes), and disease susceptibility, or phenotype.
__label__PA	In summary, our results show that cystinuria is a complex disease which is not only caused by mutations in SLC7A9 and SLC3A1, but also influenced by other modifying factors such as variants in SLC7A9.
__label__PA	In summary, our results show that cystinuria is a complex disease which is not only caused by mutations in SLC7A9 and SLC3A1, but also influenced by other modifying factors such as variants in SLC7A9.
__label__PA	Thus, we show here that SLC6A4, which has a major influence on brain serotonin availability, may be a QTL for ADHD.
__label__NA	No association was detected between the 5-HTTLPR polymorphism and OCD in either the case control study or the family study.
__label__PA	These data, if confirmed in larger studies, may begin to explain the differences in SIDS incidence by ethnicity, suggest a role for levels of 5-HTT expression in generation of SIDS susceptibility, and provide an important tool for identifying at-risk individuals and estimating the risk of recurrence.
__label__PA	These data, if confirmed in larger studies, may begin to explain the differences in SIDS incidence by ethnicity, suggest a role for levels of 5-HTT expression in generation of SIDS susceptibility, and provide an important tool for identifying at-risk individuals and estimating the risk of recurrence.
__label__PA	This indicates that the 5-HTT may be involved in the polygenic etiology of migraine with aura.
__label__PA	Differential sampling procedures may influence the proportion of AAO subgroups in a given association study, and therefore these results may explain the conflicting results obtained in studies of the association between the SLC6A4 gene polymorphism and bipolar affective disorder (BPAD).
__label__NA	These results do not suggest a major role of the short variant of 5-HTTLPR in susceptibility to SAD, but provide modest evidence for an effect on seasonality.
__label__NA	We conclude that  the 3' VNTR and three additional promoter variants in DAT1 do not appear to be associated with ADHD, or response to stimulant mediation in our sample.
__label__NA	Thus, our results do not support an association of the SLC6A3 VNTR with schizophrenia in our sample.
__label__NA	While our data do not support a major function of the NET gene in the development of panic disorder, it may play a role in the subgroup of panic disorder without agoraphobia.
__label__PA	The SLC6A14 gene is an interesting novel candidate for obesity because it encodes an amino acid transporter, which potentially regulates tryptophan availability for serotonin synthesis and thus possibly affects appetite control.
__label__PA	The SLC6A14 gene is an interesting novel candidate for obesity because it encodes an amino acid transporter, which potentially regulates tryptophan availability for serotonin synthesis and thus possibly affects appetite control.
