__label__NA	These data suggest that the IL4*-589T allele is a risk factor for life-threatening asthma and that the IL4RA*576R allele is a risk factor for a low level of lung function in asthmatic subjects.
__label__NA	These data suggest that the IL4*-589T allele is a risk factor for life-threatening asthma and that the IL4RA*576R allele is a risk factor for a low level of lung function in asthmatic subjects.
__label__PA	Together, our findings suggest that the presence of beta2AR gene polymorphisms may be inconclusive in the susceptibility to MS or in the clinical characteristics of Japanese patients with MS and, therefore, need further studies.
__label__PA	Together, our findings suggest that the presence of beta2AR gene polymorphisms may be inconclusive in the susceptibility to MS or in the clinical characteristics of Japanese patients with MS and, therefore, need further studies.
__label__PA	Variants of the ADRB2, ADRA1d and IL-4 genes may be related to a predisposition to interstitial cystitis.
__label__PA	Coupled with previous findings, our data suggest that heritable IL4 and IL10 variations may contribute to the acquisition or progression of HIV infection and that the effects of other targeted loci in the cytokine and chemokine system cannot be established unequivocally in the study populations.
__label__PA	These results indicate a possible involvement of SNPs in the IL4 gene in the development of asthma and the regulation of total serum IgE.
__label__PA	In the Amsterdam Cohort of homosexual men with HIV infection, the IL-4 -589T promoter polymorphism was associated with a delayed acquisition of X4 variants but did not affect overall disease progression.
__label__PA	We conclude that  IL-4-589*T, but not TNF-alpha-308*2 or Fcalpha RIbeta*G, is a risk factor for the development of atopy, asthma, and rhinitis by 12 mo of age.
__label__PA	We suggest that exon 5 +3953 IL1beta and IL-2 -330 promoter polymorphisms may be a genetic risk factor for RA severity.
__label__PA	These results reveal that the IL-2 gene polymorphism is associated with an increased risk of gastric atrophy induced by H. pylori infection and might predispose to gastric cancer.
__label__PA	If confirmed by others, our results indicate that more intensive GVHD prophylaxis is needed for patients with at least one IL-2 G allele, possibly directed toward blunting early host cell production of IL-2.
__label__PA	If confirmed by others, our results indicate that more intensive GVHD prophylaxis is needed for patients with at least one IL-2 G allele, possibly directed toward blunting early host cell production of IL-2.
__label__PA	Together, our findings suggest that IL-2 gene polymorphisms do not influence the susceptibility to MS or the clinical characteristics of MS in Japanese patients.
__label__PA	Together, our findings suggest that IL-2 gene polymorphisms do not influence the susceptibility to MS or the clinical characteristics of MS in Japanese patients.
__label__PA	These data indicate for the first time the relevance of the il-2 gene locus in human MS and its possible involvement in other autoimmune diseases.
__label__NA	Together, our findings suggest that IL-2 gene polymorphisms do not influence the susceptibility to MS or the clinical characteristics of MS in Japanese patients.
__label__NA	Together, our findings suggest that IL-2 gene polymorphisms do not influence the susceptibility to MS or the clinical characteristics of MS in Japanese patients.
__label__NA	Our results provide no evidence for genetic association conferred by the -384 and 114 IL-2 SNP with respect to susceptibility and severity of RA.
__label__PA	The presence of the A1 allele of the IL1RN gene is associated with a higher risk of alcoholism in Spanish men.
__label__NA	Thus, we could not confirm the results of a previous study reporting an association between the IL-1ra and IL-1 beta gene polymorphisms in patients with inflammatory bowel disease.
__label__PA	This observation provides evidence that interleukin-1 receptor antagonist may have a role in determining the genetic susceptibility to and pathogenesis of ulcerative colitis.
__label__PA	The results of this preliminary study confirm that the pro-inflammatory IL-1B genotypes, as well as male gender, are risk factors for development of gastric cancer in Mexican population.
__label__NA	IL-1 gene polymorphism may be not associated with the risk of gastric cancer in this high-risk area.
__label__PA	The IL-1 gene polymorphisms were found to play a role in the development of CAD, especially MI, in patients with CP infection.
__label__NA	Thus, we could not confirm the results of a previous study reporting an association between the IL-1ra and IL-1 beta gene polymorphisms in patients with inflammatory bowel disease.
__label__NA	Thus, we could not confirm the results of a previous study reporting an association between the IL-1ra and IL-1 beta gene polymorphisms in patients with inflammatory bowel disease.
__label__PA	The results of our study suggest a role for the IL1A gene in modifying the clinical features of migraine.
__label__PA	Our findings suggest that the IL-1 gene cluster polymorphisms may play a significant role in the pathogenesis of OA of the hip.
__label__PA	The significant association of IL13 and IL18 promoter polymorphisms with latex allergy suggests a potential location for genetic control in the induction of latex allergy in individuals and extends the understanding of the genetic basis for the induction of immediate-type hypersensitivity in healthcare workers occupationally exposed to natural rubber latex.
__label__PA	The significant association of IL13 and IL18 promoter polymorphisms with latex allergy suggests a potential location for genetic control in the induction of latex allergy in individuals and extends the understanding of the genetic basis for the induction of immediate-type hypersensitivity in healthcare workers occupationally exposed to natural rubber latex.
__label__PA	These results suggest that the IL-18 gene polymorphism is associated with a type 1 diabetes susceptibility, and there might be a gene-gene interaction between IL-18 gene with susceptible CTLA-4 gene.
__label__PA	These results suggest that the IL-18 gene polymorphism is associated with a type 1 diabetes susceptibility, and there might be a gene-gene interaction between IL-18 gene with susceptible CTLA-4 gene.
__label__NA	Our data suggest that -607 A/C (rs1946518) and -137 G/C (rs187238) polymorphisms within the IL-18-promoter region do not play a major role in RA predisposition.
__label__NA	In conclusion, our data do not support the strong positive associations of IL18 promoter polymorphisms with type I diabetes reported in previous smaller studies.
__label__PA	The 105A/C polymorphism of the IL-18 gene may be associated with the pathogenesis of asthma.
__label__NA	These results suggest that polymorphisms of the IL-18 gene are not associated with a susceptibility to AITD and type 1 diabetes coexistent with AITD in Japanese population.
__label__PA	The significant association of IL13 and IL18 promoter polymorphisms with latex allergy suggests a potential location for genetic control in the induction of latex allergy in individuals and extends the understanding of the genetic basis for the induction of immediate-type hypersensitivity in healthcare workers occupationally exposed to natural rubber latex.
__label__PA	The significant association of IL13 and IL18 promoter polymorphisms with latex allergy suggests a potential location for genetic control in the induction of latex allergy in individuals and extends the understanding of the genetic basis for the induction of immediate-type hypersensitivity in healthcare workers occupationally exposed to natural rubber latex.
__label__PA	These results suggested that the variant might act as a functional genetic factor of bronchial asthma with a unique mechanism to upregulate local and systemic IL-13 concentration in vivo.
__label__PA	The genotype of IL-13 1103C/T SNP site was associated with the susceptibility to COPD in Chinese Han population and 1103CC accounted for relative lower plasma IL-13 concentration and lower risk for COPD.
__label__PA	The genotype of IL-13 1103C/T SNP site was associated with the susceptibility to COPD in Chinese Han population and 1103CC accounted for relative lower plasma IL-13 concentration and lower risk for COPD.
__label__PA	The genotype of IL-13 1103C/T SNP site was associated with the susceptibility to COPD in Chinese Han population and 1103CC accounted for relative lower plasma IL-13 concentration and lower risk for COPD.
__label__PA	The genotype of IL-13 1103C/T SNP site was associated with the susceptibility to COPD in Chinese Han population and 1103CC accounted for relative lower plasma IL-13 concentration and lower risk for COPD.
__label__PA	Our results suggest that the Arg110Gln polymorphism of IL-13 gene is associated with susceptibility of asthma and elevated total plasma IgE in Chinese children of Han nationality in Hubei, but not with them in adults.
__label__PA	TT genotype of IL-13-1055 is not an independent factor for COPD in Chinese Han people in Beijing, but increases the risk for smokers to develop COPD and the one who has COPD family history as well.
__label__PA	TT genotype of IL-13-1055 is not an independent factor for COPD in Chinese Han people in Beijing, but increases the risk for smokers to develop COPD and the one who has COPD family history as well.
__label__PA	TT genotype of IL-13-1055 is not an independent factor for COPD in Chinese Han people in Beijing, but increases the risk for smokers to develop COPD and the one who has COPD family history as well.
__label__PA	The results of our study indicate that atopic diseases are caused, in part, by impairment of the IL-12 signal cascade, which downregulates IgE production, and that the mutation of the IL-12R beta(2) chain gene is one of the causative genes for atopy.
__label__PA	The results of our study indicate that atopic diseases are caused, in part, by impairment of the IL-12 signal cascade, which downregulates IgE production, and that the mutation of the IL-12R beta(2) chain gene is one of the causative genes for atopy.
__label__PA	IL12B may be an important asthma gene.
__label__NA	Our data reveal that the IL12B 1188 (A-->C) gene polymorphism is not involved in defining the genetic basis of the susceptibility to and final outcome of peptic ulcer disease.
__label__NA	Together, psoriasis is not associated with a promoter polymorphism in the IL12B gene nor with the production of IL-12p70 by LPS-stimulated blood cells.
__label__NA	Our results do not support earlier reports of an association between allele 1 in the 3'UTR of the IL12B gene and type 1 diabetes.
__label__NA	Our results do not support earlier reports of an association between allele 1 in the 3'UTR of the IL12B gene and type 1 diabetes.
__label__PA	Our work implies that IL-10R1 SNP4 is a recessively inherited risk factor for hepatic cirrhosis in HCV genotype-1 infection.
__label__PA	Coupled with previous findings, our data suggest that heritable IL4 and IL10 variations may contribute to the acquisition or progression of HIV infection and that the effects of other targeted loci in the cytokine and chemokine system cannot be established unequivocally in the study populations.
__label__PA	The observed association suggests that individuals with interleukin-8-251TT and interleukin-10-819TT, a combination presumably causing mild inflammation, have a higher probability of the continuing Helicobacter pylori infection, especially among current smokers.
__label__PA	These findings suggest that genetic polymorphisms in IL-8, IL-10 and TNFalpha may play important roles in developing gastric cancer in the Chinese population.
__label__PA	These data suggest that the IL-10 gene may confer susceptibility to the development of schizophrenia in the Chinese population.
__label__PA	Polymorphism of IL-10 -819C/T SNP site is associated with susceptibility to COPD in Chinese Han people; at least five haplotypes of IL-10 gene promoter (ATA, ACC, GCC, ATC and ACA) exist in Chinese Han people.
__label__PA	Polymorphism of IL-10 -819C/T SNP site is associated with susceptibility to COPD in Chinese Han people; at least five haplotypes of IL-10 gene promoter (ATA, ACC, GCC, ATC and ACA) exist in Chinese Han people.
__label__PA	These data could partly explain the abnormal secretion of IL-10 occurring in schizophrenic patients in response to infections or different stressors and suggest a potential role of IL-10 as a candidate gene for susceptibility to schizophrenia.
__label__PA	These data could partly explain the abnormal secretion of IL-10 occurring in schizophrenic patients in response to infections or different stressors and suggest a potential role of IL-10 as a candidate gene for susceptibility to schizophrenia.
__label__PA	These data suggest that the exon 1 G2133C missense variant in IGFBP3 may be a susceptibility factor for colorectal cancer.
__label__PA	These results indicated that IGFBP3 polymorphisms may be associated with the level of blood IGFBP-3 protein and an increased risk of breast cancer.
__label__PA	These results indicated that IGFBP3 polymorphisms may be associated with the level of blood IGFBP-3 protein and an increased risk of breast cancer.
__label__PA	Our results suggest that genetic variation of IGF2R may influence significantly the risk of oral cancer.
__label__NA	Although a modest association cannot be excluded, our data do not support an important relation between this IGF-1 gene polymorphism and breast cancer risk.
__label__PA	In conclusion, we report a novel SNP in the IGF-I regulatory region that is associated with colorectal cancer risk.
__label__PA	Our study suggests that a genetically determined exposure to relatively low IGF-I levels is associated with an increased risk for type 2 diabetes and myocardial infarction.
__label__NA	These data represent an important negative finding and suggest that, while IFNGR1 is implicated in rare Mendelian susceptibility to mycobacterial disease, the common variants studied here do not have a major influence on susceptibility to pulmonary TB in The Gambian population.
__label__PA	These findings suggest an association between the genetic ability to produce low levels of IFN-gamma and the susceptibility to develop chronic HBV infection.
__label__PA	Persons who are homozygous for the IFNG +874A allele may have a higher risk of contracting brucellosis.
__label__PA	The results of this study indicate that IFN-gamma may contribute to the development of type 2 diabetes, based on a combination of molecular and immunological observations.
__label__PA	Polymorphisms of IFNG may contribute to differences in susceptibility to MS between men and women.
__label__PA	The results suggest that the IFNG CA-repeat polymorphism is associated with susceptibility to endometriosis in a Japanese population.
__label__NA	We conclude that  IFNG gene polymorphism is not associated with development of AD.
__label__NA	We have failed to confirm the association between the IFN-gamma gene polymorphism and rheumatoid arthritis susceptibility or severity.
__label__PA	These results suggested that among IFNG and related genes, IFNG and IRF1 genes confer genetic susceptibility to atopic asthma in Japanese children.
__label__PA	These results suggested that among IFNG and related genes, IFNG and IRF1 genes confer genetic susceptibility to atopic asthma in Japanese children.
__label__PA	This preferential binding suggests that genetically determined variability in interferon gamma and expression might be important for the development of tuberculosis.
__label__PA	These results suggest that the IFN-gamma gene region may contribute to the pathogenesis of IDDM and could be a genetic marker for IDDM.
__label__PA	These results suggest that the IFN-gamma gene region may contribute to the pathogenesis of IDDM and could be a genetic marker for IDDM.
__label__PA	The results of this study suggest that the 184Ile homozygote of the IFNA17 gene may represent an important susceptibility biomarker for cervical cancer risk.
__label__PA	These results provide strong evidence for pathogenic variant(s) in the 276-kb region harboring IDE that influence intermediate AD phenotypes and risk for AD.
__label__PA	These results provide strong evidence for pathogenic variant(s) in the 276-kb region harboring IDE that influence intermediate AD phenotypes and risk for AD.
__label__PA	These results provide substantial evidence that genetic variation within or extremely close to IDE impacts both disease risk and traits related to the severity of AD.
__label__NA	Our findings suggest that the G241R and K469E polymorphisms in the ICAM-1 gene are unlikely to be associated with an increased risk of endometriosis in the Japanese population.
__label__PA	These data suggest that the ICAM-1 469KK genotype could be a genetic risk factor for retinopathy in Type 2 diabetes mellitus.
__label__PA	Our data indicate an aetiological role for ICAM-1 in type 1 diabetes, which needs to be confirmed in future genetic and functional experiments.
__label__NA	We therefore conclude that the E469K polymorphism of ICAM1 is not a risk factor for AD or PD.
__label__NA	ICAM-1 polymorphisms are not genetic risk factors for the susceptibility and severity of GCA in Northwest Spain.
__label__PA	Our data suggest that the islet amyloid polypeptide gene mutation might be associated with early occurrence of type 2 diabetes and lower plasma levels of total and low density lipoprotein-cholesterol in the Chinese population.
__label__NA	In conclusion, the association of ApoE epsilon4 to AD in a sample of patients from the Basque Country is confirmed, though the association to C267T polymorphism of the 5-HT(6) receptor has not been observed.
__label__NA	Our results suggest that the 5-HT6 receptor gene polymorphism does not confer increased susceptibility to schizophrenia.
__label__PA	These findings show that the C178T(Pro16Ser) variant in HTR3A may represent a functional variant and affect the susceptibility to bipolar disorder.
__label__PA	These findings show that the C178T(Pro16Ser) variant in HTR3A may represent a functional variant and affect the susceptibility to bipolar disorder.
__label__NA	Our data do not support the involvement of 5-HT(1B/1D) and 5-HT(2C) receptor gene polymorphisms in migraine with aura, yet do suggest a possible role for a locus at or near the hSERT gene in the susceptibility to migraine with aura.
__label__NA	Our data do not support the involvement of 5-HT(1B/1D) and 5-HT(2C) receptor gene polymorphisms in migraine with aura, yet do suggest a possible role for a locus at or near the hSERT gene in the susceptibility to migraine with aura.
__label__NA	Overall our results indicates that the HTR2A, 5-HTT, DRD3 and GABA(A)gamma2 genes are not likely to be a major genetic risk factor for heroin abuse in this population, with the exception of possible association between nasal inhalation and DRD2 promoter - 141DeltaC polymorphism.
__label__PA	In conclusion, from genetic association analysis of this schizophrenic population, a significant association is clearly determined between the HTR2 genetic polymorphism and the presence of schizophrenic disorder, manifested as increased risk of schizophrenia for carriers of the T-102 allele.
__label__PA	In conclusion, from genetic association analysis of this schizophrenic population, a significant association is clearly determined between the HTR2 genetic polymorphism and the presence of schizophrenic disorder, manifested as increased risk of schizophrenia for carriers of the T-102 allele.
__label__PA	The study showed a positive association between panic disorder and the HTR2A gene, suggesting that HTR2A plays an important role in the pathogenesis of panic disorder.
__label__PA	The study showed a positive association between panic disorder and the HTR2A gene, suggesting that HTR2A plays an important role in the pathogenesis of panic disorder.
__label__PA	The study showed a positive association between panic disorder and the HTR2A gene, suggesting that HTR2A plays an important role in the pathogenesis of panic disorder.
__label__PA	The study showed a positive association between panic disorder and the HTR2A gene, suggesting that HTR2A plays an important role in the pathogenesis of panic disorder.
__label__NA	These results suggest that the interaction between 5-HTTLPR and 5-HTR2A polymorphisms may not contribute to susceptibility to schizophrenia as well as some clinical factors such as antipsychotic response, at least in the Korean population.
__label__NA	These data did not provide evidence for a contribution of the 102T/C SNP of HTR2A gene to susceptibility to the southern Han Chinese schizophrenia.
__label__NA	Overall, our results suggest that the investigated 5-HT2A polymorphisms are not major susceptibility factors in the etiology of ADHD.
__label__PA	In this, to our knowledge, first association study based on children and adolescents with OCD, we confirm an association of the A-allele of the 5-HT2A receptor gene with OCD.
__label__PA	In this, to our knowledge, first association study based on children and adolescents with OCD, we confirm an association of the A-allele of the 5-HT2A receptor gene with OCD.
__label__PA	Although further studies are necessary, these results in a Korean population suggest that -1438A/G polymorphism of 5-HT2A receptor gene promoter may be causally related to the development of bipolar disorder.
__label__PA	This data indicates that the T102C polymorphism in the 5-HT(2A) gene might be an independent risk factor for increased blood pressure in female individuals with essential hypertension.
__label__NA	Overall our results indicates that the HTR2A, 5-HTT, DRD3 and GABA(A)gamma2 genes are not likely to be a major genetic risk factor for heroin abuse in this population, with the exception of possible association between nasal inhalation and DRD2 promoter - 141DeltaC polymorphism.
__label__PA	This data indicates that the T102C polymorphism in the 5-HT(2A) gene might be an independent risk factor for increased blood pressure in female individuals with essential hypertension.
__label__NA	Our results suggest that MAO-A, COMT, 5-HT2A, DRD2, and DRD4 gene variants are not involved in susceptibility toward different time courses in mood disorders.
__label__PA	These results suggest that variation in the 5-HT2A receptor gene may play a role in the development of major depression with seasonal pattern and support the existence of a genetic and etiological heterogeneity underlying the diagnosis of major depression.
__label__PA	These results suggest that variation in the 5-HT2A receptor gene may play a role in the development of major depression with seasonal pattern and support the existence of a genetic and etiological heterogeneity underlying the diagnosis of major depression.
__label__PA	The association detected in this study suggests that the 5-HT(2A) receptor gene may play a role in the genetic susceptibility to bipolar disorder, through a specific subgroup of bipolar type I patients with lower risk of suicidal behavior.
__label__NA	Overall, our results suggest that the investigated 5-HT2A polymorphisms are not major susceptibility factors in the etiology of ADHD.
__label__NA	Our data do not support the involvement of 5-HT(1B/1D) and 5-HT(2C) receptor gene polymorphisms in migraine with aura, yet do suggest a possible role for a locus at or near the hSERT gene in the susceptibility to migraine with aura.
__label__NA	Our data do not support the involvement of 5-HT(1B/1D) and 5-HT(2C) receptor gene polymorphisms in migraine with aura, yet do suggest a possible role for a locus at or near the hSERT gene in the susceptibility to migraine with aura.
__label__NA	In conclusion, these data do not support the idea that HTR1B gene plays a major role in the etiopathogenesis of schizophrenia in Chinese Han population.
__label__NA	The 5-HT(1B) receptor gene may thus not be a key component in the genetic background underlying alcohol dependence in human and alcohol preference in rodents, although these results should be considered as preliminary according to the small size of our sample.
__label__NA	These findings suggest that the investigated 5-HT1B genetic polymorphism does not play a major role in the pathogenesis of schizophrenic disorders.
__label__NA	It is concluded that perlecan gene intron 6 BamHI polymorphism is not a suitable genetic marker of MVP in Taiwan Chinese
__label__NA	These findings show no evidence for association between HSPG2 intron 6 BamHI polymorphism and AD in our population.
__label__NA	It is concluded that perlecan gene intron 6 BamHI polymorphism is not a suitable genetic marker of MVP in Taiwan Chinese
__label__NA	Our data indicate that HSP70-2 gene polymorphism as opposed to the other ethnic groups does not appear to be relevant in SLE susceptibility in Mexican patients and that the distribution of the different alleles depend on the frequency of HLA alleles associated with them.
__label__NA	Our data indicate that HSP70-2 gene polymorphism as opposed to the other ethnic groups does not appear to be relevant in SLE susceptibility in Mexican patients and that the distribution of the different alleles depend on the frequency of HLA alleles associated with them.
__label__PA	We concluded that HSPA1B (1267)GG and HSPA1L (2437)CC genotypes were more frequent among preeclamptic than control patients, suggesting that these genotypes may play a role in the susceptibility for preeclampsia.
__label__NA	These findings suggest that rare alleles at the Hras1 locus may be associated with hereditary predisposition to COPD and the development of pneumofibrosis, while mutations in microsatellite markers result from exposure to tobacco smoke carcinogens and are not associated with the appearance of these pathologies.
